[
  {
    "code": "AED",
    "numericCode": "784",
    "englishName": "UAE Dirham",
    "decimalPlaces": 2,
    "kind": "NationalCurrency",
    "isTender": true,
    "territories": [ "AE" ]
  },
  {
    "code": "AUD",
    "numericCode": "036",
    "englishName": "Australian Dollar",
    "decimalPlaces": 2,
    "kind": "NationalCurrency",
    "isTender": true,
    "territories": [ "AU" ]
  },
  {
    "code": "BHD",
    "numericCode": "048",
    "englishName": "Bahraini Dinar",
    "decimalPlaces": 3,
    "kind": "NationalCurrency",
    "isTender": true,
    "territories": [ "BH" ]
  },
  {
    "code": "CAD",
    "numericCode": "124",
    "englishName": "Canadian Dollar",
    "decimalPlaces": 2,
    "kind": "NationalCurrency",
    "isTender": true,
    "territories": [ "CA" ]
  },
  {
    "code": "CHF",
    "numericCode": "756",
    "englishName": "Swiss Franc",
    "decimalPlaces": 2,
    "kind": "NationalCurrency",
    "isTender": true,
    "territories": [ "CH", "LI" ],
    "cashDecimalPlaces": 2,
    "cashRoundingIncrement": 0.05
  },
  {
    "code": "CLF",
    "numericCode": "990",
    "englishName": "Unidad de Fomento",
    "decimalPlaces": 4,
    "kind": "Fund",
    "isTender": false,
    "territories": [ "CL" ]
  },
  {
    "code": "CLP",
    "numericCode": "152",
    "englishName": "Chilean Peso",
    "decimalPlaces": 0,
    "kind": "NationalCurrency",
    "isTender": true,
    "territories": [ "CL" ]
  },
  {
    "code": "CNY",
    "numericCode": "156",
    "englishName": "Yuan Renminbi",
    "decimalPlaces": 2,
    "kind": "NationalCurrency",
    "isTender": true,
    "territories": [ "CN" ]
  },
  {
    "code": "DKK",
    "numericCode": "208",
    "englishName": "Danish Krone",
    "decimalPlaces": 2,
    "kind": "NationalCurrency",
    "isTender": true,
    "territories": [ "DK" ]
  },
  {
    "code": "EUR",
    "numericCode": "978",
    "englishName": "Euro",
    "decimalPlaces": 2,
    "kind": "NationalCurrency",
    "isTender": true,
    "territories": [ "AD", "AT", "BE", "CY", "DE", "EE", "ES", "FI", "FR", "GR", "HR", "IE", "IT", "LT", "LU", "LV", "MC", "MT", "NL", "PT", "SI", "SK", "SM", "VA" ]
  },
  {
    "code": "GBP",
    "numericCode": "826",
    "englishName": "Pound Sterling",
    "decimalPlaces": 2,
    "kind": "NationalCurrency",
    "isTender": true,
    "territories": [ "GB", "GG", "IM", "JE" ]
  },
  {
    "code": "HKD",
    "numericCode": "344",
    "englishName": "Hong Kong Dollar",
    "decimalPlaces": 2,
    "kind": "NationalCurrency",
    "isTender": true,
    "territories": [ "HK" ]
  },
  {
    "code": "ILS",
    "numericCode": "376",
    "englishName": "New Israeli Sheqel",
    "decimalPlaces": 2,
    "kind": "NationalCurrency",
    "isTender": true,
    "territories": [ "IL" ]
  },
  {
    "code": "INR",
    "numericCode": "356",
    "englishName": "Indian Rupee",
    "decimalPlaces": 2,
    "kind": "NationalCurrency",
    "isTender": true,
    "territories": [ "IN" ]
  },
  {
    "code": "JPY",
    "numericCode": "392",
    "englishName": "Yen",
    "decimalPlaces": 0,
    "kind": "NationalCurrency",
    "isTender": true,
    "territories": [ "JP" ]
  },
  {
    "code": "KRW",
    "numericCode": "410",
    "englishName": "Won",
    "decimalPlaces": 0,
    "kind": "NationalCurrency",
    "isTender": true,
    "territories": [ "KR" ]
  },
  {
    "code": "KWD",
    "numericCode": "414",
    "englishName": "Kuwaiti Dinar",
    "decimalPlaces": 3,
    "kind": "NationalCurrency",
    "isTender": true,
    "territories": [ "KW" ]
  },
  {
    "code": "MXN",
    "numericCode": "484",
    "englishName": "Mexican Peso",
    "decimalPlaces": 2,
    "kind": "NationalCurrency",
    "isTender": true,
    "territories": [ "MX" ]
  },
  {
    "code": "NOK",
    "numericCode": "578",
    "englishName": "Norwegian Krone",
    "decimalPlaces": 2,
    "kind": "NationalCurrency",
    "isTender": true,
    "territories": [ "NO" ]
  },
  {
    "code": "NZD",
    "numericCode": "554",
    "englishName": "New Zealand Dollar",
    "decimalPlaces": 2,
    "kind": "NationalCurrency",
    "isTender": true,
    "territories": [ "NZ" ]
  },
  {
    "code": "OMR",
    "numericCode": "512",
    "englishName": "Rial Omani",
    "decimalPlaces": 3,
    "kind": "NationalCurrency",
    "isTender": true,
    "territories": [ "OM" ]
  },
  {
    "code": "SEK",
    "numericCode": "752",
    "englishName": "Swedish Krona",
    "decimalPlaces": 2,
    "kind": "NationalCurrency",
    "isTender": true,
    "territories": [ "SE" ]
  },
  {
    "code": "SGD",
    "numericCode": "702",
    "englishName": "Singapore Dollar",
    "decimalPlaces": 2,
    "kind": "NationalCurrency",
    "isTender": true,
    "territories": [ "SG" ]
  },
  {
    "code": "TND",
    "numericCode": "788",
    "englishName": "Tunisian Dinar",
    "decimalPlaces": 3,
    "kind": "NationalCurrency",
    "isTender": true,
    "territories": [ "TN" ]
  },
  {
    "code": "USD",
    "numericCode": "840",
    "englishName": "US Dollar",
    "decimalPlaces": 2,
    "kind": "NationalCurrency",
    "isTender": true,
    "territories": [ "US" ]
  },
  {
    "code": "UYW",
    "numericCode": "927",
    "englishName": "Unidad Previsional",
    "decimalPlaces": 4,
    "kind": "Fund",
    "isTender": false,
    "territories": [ "UY" ]
  },
  {
    "code": "VND",
    "numericCode": "704",
    "englishName": "Dong",
    "decimalPlaces": 0,
    "kind": "NationalCurrency",
    "isTender": true,
    "territories": [ "VN" ]
  },
  {
    "code": "XAG",
    "numericCode": "961",
    "englishName": "Silver",
    "decimalPlaces": null,
    "kind": "PreciousMetal",
    "isTender": false,
    "territories": []
  },
  {
    "code": "XAU",
    "numericCode": "959",
    "englishName": "Gold",
    "decimalPlaces": null,
    "kind": "PreciousMetal",
    "isTender": false,
    "territories": []
  },
  {
    "code": "XXX",
    "numericCode": "999",
    "englishName": "No Currency",
    "decimalPlaces": null,
    "kind": "NoCurrency",
    "isTender": false,
    "territories": []
  }
]
